{
  "id": "period-korea-mumun-seed-i",
  "entity": "period",
  "names": {
    "zh": "无文窗SeedI",
    "en": "Mumun Seed I",
    "native": null
  },
  "civilization_ids": [
    "civ-early-korea"
  ],
  "time": {
    "label": "Mumun pottery period",
    "approx_from_bce": null,
    "approx_to_bce": null,
    "scheme_note": "Mumun pottery period"
  },
  "summary": {
    "zh": "无文陶器期。",
    "en": "Mumun pottery period.",
    "native": null
  },
  "sources": [
    "src-korea-mumun-seed-i",
    "src-korea-nelson-seed-i"
  ],
  "editorial": {
    "derived_from": [
      "tools/hot_densify/densify_seed_batch_i.py",
      "docs/coverage-map.md",
      "docs/decisions.md#d-2026-10-13-03"
    ],
    "derived_on": "2026-10-13",
    "notes": "Seed densify Batch I toward ~48 sources (D-2026-10-13-03). No invented pages/coords/finds/media. Status stays library-seed-rich."
  }
}
