{
  "id": "period-elam-neo-deepen",
  "entity": "period",
  "names": {
    "zh": "新埃兰加深窗",
    "en": "Neo-Elamite deepen window",
    "native": null
  },
  "civilization_ids": [
    "civ-elam-iran"
  ],
  "time": {
    "label": "Neo-Elamite polities into early Achaemenid frame",
    "approx_from_bce": null,
    "approx_to_bce": null,
    "scheme_note": "Neo-Elamite polities into early Achaemenid frame"
  },
  "summary": {
    "zh": "新埃兰政体至早期阿契美尼德框。",
    "en": "Neo-Elamite polities into early Achaemenid frame.",
    "native": null
  },
  "sources": [
    "src-elam-neo-elamite-deepen",
    "src-elam-alvarez-mon-deepen"
  ],
  "editorial": {
    "derived_from": [
      "tools/hot_densify/densify_hot_batch_b.py",
      "docs/coverage-map.md",
      "docs/decisions.md#d-2026-10-12-21"
    ],
    "derived_on": "2026-10-12",
    "notes": "Hot-pack densify Batch B toward fact-library (D-2026-10-12-21). No invented pages/coords/finds/media art. Status stays library-seed-rich unless depth warrants fact-library."
  }
}
