{
  "id": "period-moche-eip-floruit",
  "entity": "period",
  "names": {
    "zh": "莫切早期中间期繁荣窗",
    "en": "Moche Early Intermediate floruit"
  },
  "civilization_ids": [
    "civ-moche"
  ],
  "time": {
    "label": "broadly 1st–8th centuries CE (Quilter / Castillo working frame)",
    "approx_from_bce": null,
    "approx_to_bce": null,
    "scheme_note": "Phase I–V debates open; shell window only."
  },
  "summary": {
    "zh": "壳级莫切窗。",
    "en": "Shell Moche window."
  },
  "sources": [
    "src-moche-quilter-2010",
    "src-moche-castillo-uceda-orientation"
  ],
  "editorial": {
    "derived_from": [
      "tools/wave3_shells/generate_wave3.py",
      "docs/coverage-map.md",
      "docs/decisions.md#d-2026-10-12-15"
    ],
    "derived_on": "2026-10-12",
    "notes": "Wave-3 library-seed shell (D-2026-10-12-15). Abstract/TOC-level claims only; no invented pages, coords, or finds."
  }
}
