{
  "id": "period-anatolia-assyrian-colony",
  "entity": "period",
  "names": {
    "zh": "安纳托利亚亚述商站窗",
    "en": "Anatolian Assyrian Colony window"
  },
  "civilization_ids": [
    "civ-anatolia-hittite"
  ],
  "time": {
    "label": "ca. 20th–18th c. BCE Kaneš kārum floruit (Özgüç tradition)",
    "approx_from_bce": 2000,
    "approx_to_bce": 1700,
    "scheme_note": "Pre-Hittite Kaneš archive window."
  },
  "summary": {
    "zh": "卡内什商站繁荣窗。",
    "en": "Kaneš kārum floruit window."
  },
  "sources": [
    "src-hittite-ozguc-kultepe-orientation",
    "src-hittite-bryce-2005"
  ],
  "editorial": {
    "derived_from": [
      "tools/wave1_shells/densify_wave1.py",
      "docs/coverage-map.md",
      "docs/decisions.md#d-2026-10-12-13"
    ],
    "derived_on": "2026-10-12",
    "notes": "Wave-1 densify to library-seed-rich (D-2026-10-12-13). No invented pages/coords/finds/media art. Honest thin > fake dense."
  }
}
