{
  "id": "period-lapita-remote-seed-l",
  "entity": "period",
  "names": {
    "zh": "远大洋洲扩张窗SeedL",
    "en": "Remote Oceania expansion Seed L",
    "native": null
  },
  "civilization_ids": [
    "civ-lapita-pacific"
  ],
  "time": {
    "label": "Remote colonization",
    "approx_from_bce": null,
    "approx_to_bce": null,
    "scheme_note": "Remote colonization"
  },
  "summary": {
    "zh": "远洋扩张。",
    "en": "Remote expansion.",
    "native": null
  },
  "sources": [
    "src-lapita-remote-oceania-seed-l",
    "src-lapita-chronology-seed-l"
  ],
  "editorial": {
    "derived_from": [
      "tools/hot_densify/densify_seed_batch_l.py",
      "docs/coverage-map.md",
      "docs/decisions.md#d-2026-10-13-06"
    ],
    "derived_on": "2026-10-13",
    "notes": "Seed densify Batch L toward ~71 sources (D-2026-10-13-06). No invented pages/coords/finds/media. Status stays library-seed-rich."
  }
}
